{
  "schema_version": 1,
  "catalog_version": "exam-identity-v2",
  "provider_id": "moex",
  "owner": "catalog maintainers",
  "facts": [
    {
      "id": "moex-089080-category-009",
      "source_exam_id": "089080",
      "year_ad": 2000,
      "category_code": "009",
      "category_raw": "財務行政類",
      "exam_name_raw": "089年高等檢定、中醫檢定考試",
      "series_id": "eligibility-qualification",
      "level_id": "qualification-high",
      "reviewed_at": "2026-10-07",
      "reason": "Manually reviewed the checksum-verified official question header because the historical category omits its native grade or eligibility level. Event title order and numeric source codes do not determine classification.",
      "evidence": [
        {
          "source_url": "https://wwwq.moex.gov.tw/exam/wHandExamQandA_File.ashx?t=Q&code=089080&c=009&s=2001&q=1",
          "subject_code": "2001",
          "checksum": "e940be99ac4f19f8bd4d204146566c4850e4df76198bac0d46dfddbe7c754bd5",
          "observation": "The official title states 高等檢定考試; this is an eligibility test, not a civil-service high examination."
        }
      ]
    },
    {
      "id": "moex-089080-category-010",
      "source_exam_id": "089080",
      "year_ad": 2000,
      "category_code": "010",
      "category_raw": "法務類",
      "exam_name_raw": "089年高等檢定、中醫檢定考試",
      "series_id": "eligibility-qualification",
      "level_id": "qualification-high",
      "reviewed_at": "2026-10-07",
      "reason": "Manually reviewed the checksum-verified official question header because the historical category omits its native grade or eligibility level. Event title order and numeric source codes do not determine classification.",
      "evidence": [
        {
          "source_url": "https://wwwq.moex.gov.tw/exam/wHandExamQandA_File.ashx?t=Q&code=089080&c=010&s=2001&q=1",
          "subject_code": "2001",
          "checksum": "45e0448760c0b73fd69d0a628efe3055f5dafe5985dc9c626fc2dda9c56c7166",
          "observation": "The official title states 高等檢定考試; this is an eligibility test, not a civil-service high examination."
        }
      ]
    },
    {
      "id": "moex-090070-category-001",
      "source_exam_id": "090070",
      "year_ad": 2001,
      "category_code": "001",
      "category_raw": "財務行政類",
      "exam_name_raw": "090年高等檢定、中醫檢定考試",
      "series_id": "eligibility-qualification",
      "level_id": "qualification-high",
      "reviewed_at": "2026-10-07",
      "reason": "Manually reviewed the checksum-verified official question header because the historical category omits its native grade or eligibility level. Event title order and numeric source codes do not determine classification.",
      "evidence": [
        {
          "source_url": "https://wwwq.moex.gov.tw/exam/wHandExamQandA_File.ashx?t=Q&code=090070&c=001&s=2001&q=1",
          "subject_code": "2001",
          "checksum": "5c6eab33a3acc6267368d54955238b082cca5befaf8af6516198d2a8bb6e12ba",
          "observation": "The official title states 高等檢定考試; this is an eligibility test, not a civil-service high examination."
        }
      ]
    },
    {
      "id": "moex-090070-category-002",
      "source_exam_id": "090070",
      "year_ad": 2001,
      "category_code": "002",
      "category_raw": "法務類",
      "exam_name_raw": "090年高等檢定、中醫檢定考試",
      "series_id": "eligibility-qualification",
      "level_id": "qualification-high",
      "reviewed_at": "2026-10-07",
      "reason": "Manually reviewed the checksum-verified official question header because the historical category omits its native grade or eligibility level. Event title order and numeric source codes do not determine classification.",
      "evidence": [
        {
          "source_url": "https://wwwq.moex.gov.tw/exam/wHandExamQandA_File.ashx?t=Q&code=090070&c=002&s=2001&q=1",
          "subject_code": "2001",
          "checksum": "3553e22323dc3cb7b2874c631ce796b4d431482cfc31fe2c138bfb211ba274af",
          "observation": "The official title states 高等檢定考試; this is an eligibility test, not a civil-service high examination."
        }
      ]
    },
    {
      "id": "moex-091010-category-101",
      "source_exam_id": "091010",
      "year_ad": 2002,
      "category_code": "101",
      "category_raw": "公職獸醫師",
      "exam_name_raw": "091年公務人員高等考試一級暨二級考試",
      "series_id": "civil-high",
      "level_id": "grade-1",
      "reviewed_at": "2026-10-07",
      "reason": "Manually reviewed the checksum-verified official question header because the historical category omits its native grade or eligibility level. Event title order and numeric source codes do not determine classification.",
      "evidence": [
        {
          "source_url": "https://wwwq.moex.gov.tw/exam/wHandExamQandA_File.ashx?t=Q&code=091010&c=101&s=1003&q=1",
          "subject_code": "1003",
          "checksum": "040550645372fc8229da2407eef6b727cbcf24d2514bc5e874c871631f1e6f50",
          "observation": "The official header identifies 公務人員高等考試 and explicitly states 一級考試."
        }
      ]
    },
    {
      "id": "moex-091010-category-102",
      "source_exam_id": "091010",
      "year_ad": 2002,
      "category_code": "102",
      "category_raw": "醫學工程",
      "exam_name_raw": "091年公務人員高等考試一級暨二級考試",
      "series_id": "civil-high",
      "level_id": "grade-1",
      "reviewed_at": "2026-10-07",
      "reason": "Manually reviewed the checksum-verified official question header because the historical category omits its native grade or eligibility level. Event title order and numeric source codes do not determine classification.",
      "evidence": [
        {
          "source_url": "https://wwwq.moex.gov.tw/exam/wHandExamQandA_File.ashx?t=Q&code=091010&c=102&s=1003&q=1",
          "subject_code": "1003",
          "checksum": "d1a119ca28d33b486dd880e4842ef072ef5e38d9cfcb4056476d493f4edb2283",
          "observation": "The official header identifies 公務人員高等考試 and explicitly states 一級考試."
        }
      ]
    },
    {
      "id": "moex-091010-category-201",
      "source_exam_id": "091010",
      "year_ad": 2002,
      "category_code": "201",
      "category_raw": "一般民政",
      "exam_name_raw": "091年公務人員高等考試一級暨二級考試",
      "series_id": "civil-high",
      "level_id": "grade-2",
      "reviewed_at": "2026-10-07",
      "reason": "Manually reviewed the checksum-verified official question header because the historical category omits its native grade or eligibility level. Event title order and numeric source codes do not determine classification.",
      "evidence": [
        {
          "source_url": "https://wwwq.moex.gov.tw/exam/wHandExamQandA_File.ashx?t=Q&code=091010&c=201&s=5001&q=1",
          "subject_code": "5001",
          "checksum": "c693d90c8cd763819f7496127c720e489c1a50b3719c8777b311ae1c7faad671",
          "observation": "The official header identifies 公務人員高等考試 and explicitly states 二級考試."
        }
      ]
    },
    {
      "id": "moex-091010-category-202",
      "source_exam_id": "091010",
      "year_ad": 2002,
      "category_code": "202",
      "category_raw": "人事行政",
      "exam_name_raw": "091年公務人員高等考試一級暨二級考試",
      "series_id": "civil-high",
      "level_id": "grade-2",
      "reviewed_at": "2026-10-07",
      "reason": "Manually reviewed the checksum-verified official question header because the historical category omits its native grade or eligibility level. Event title order and numeric source codes do not determine classification.",
      "evidence": [
        {
          "source_url": "https://wwwq.moex.gov.tw/exam/wHandExamQandA_File.ashx?t=Q&code=091010&c=202&s=5001&q=1",
          "subject_code": "5001",
          "checksum": "783eebb5bec39c83bf9aa2dbc7fb2a4bff05a52599cb7781f7c1d5692ed80034",
          "observation": "The official header identifies 公務人員高等考試 and explicitly states 二級考試."
        }
      ]
    },
    {
      "id": "moex-091010-category-203",
      "source_exam_id": "091010",
      "year_ad": 2002,
      "category_code": "203",
      "category_raw": "史料編纂",
      "exam_name_raw": "091年公務人員高等考試一級暨二級考試",
      "series_id": "civil-high",
      "level_id": "grade-2",
      "reviewed_at": "2026-10-07",
      "reason": "Manually reviewed the checksum-verified official question header because the historical category omits its native grade or eligibility level. Event title order and numeric source codes do not determine classification.",
      "evidence": [
        {
          "source_url": "https://wwwq.moex.gov.tw/exam/wHandExamQandA_File.ashx?t=Q&code=091010&c=203&s=1001&q=1",
          "subject_code": "1001",
          "checksum": "7a393645c1b44aa167297bfddc6a4e93f203ac4a27ec9c79f4b3248677156d8e",
          "observation": "The official header identifies 公務人員高等考試 and explicitly states 二級考試."
        }
      ]
    },
    {
      "id": "moex-091010-category-204",
      "source_exam_id": "091010",
      "year_ad": 2002,
      "category_code": "204",
      "category_raw": "圖書資訊管理",
      "exam_name_raw": "091年公務人員高等考試一級暨二級考試",
      "series_id": "civil-high",
      "level_id": "grade-2",
      "reviewed_at": "2026-10-07",
      "reason": "Manually reviewed the checksum-verified official question header because the historical category omits its native grade or eligibility level. Event title order and numeric source codes do not determine classification.",
      "evidence": [
        {
          "source_url": "https://wwwq.moex.gov.tw/exam/wHandExamQandA_File.ashx?t=Q&code=091010&c=204&s=1001&q=1",
          "subject_code": "1001",
          "checksum": "ab8d403340483c3d26d41ea82b77bd0e7e57d9ef3c84cba197f5e29bc912f789",
          "observation": "The official header identifies 公務人員高等考試 and explicitly states 二級考試."
        }
      ]
    },
    {
      "id": "moex-091010-category-205",
      "source_exam_id": "091010",
      "year_ad": 2002,
      "category_code": "205",
      "category_raw": "博物管理",
      "exam_name_raw": "091年公務人員高等考試一級暨二級考試",
      "series_id": "civil-high",
      "level_id": "grade-2",
      "reviewed_at": "2026-10-07",